{
  "$schema": "https://json-schema.org/draft/2020-12/schema",
  "version": 1,
  "type": "object",
  "required": ["block_id", "changed", "findings", "claims"],
  "properties": {"block_id": {"type": "string"}, "changed": {"type": "boolean"}, "findings": {"type": "array"}, "claims": {"type": "array", "items": {"type": "object", "required": ["claim", "support"], "properties": {"claim": {"type": "string"}, "support": {"type": "string"}}}}}
}
